{
  "$schema": "https://json-schema.org/draft/2020-12/schema",
  "$id": "https://luxverso.org/catalog/release/v1",
  "title": "LuxVerso Dataset Release v1",
  "type": "object",
  "required": ["schema_version", "slug", "title", "source", "status", "period", "coverage", "assets", "provenance", "access", "limitations"],
  "properties": {
    "schema_version": {"const": "dataset-release-v1"},
    "slug": {"type": "string", "pattern": "^[a-z0-9-]+$"},
    "title": {"type": "string", "minLength": 1},
    "source": {"type": "string", "minLength": 1},
    "status": {"enum": ["public"]},
    "period": {"type": "object", "required": ["start", "end", "label"]},
    "coverage": {"type": "object", "required": ["uf_count", "month_count", "file_count", "scope"]},
    "assets": {"type": "object", "required": ["format", "total_bytes", "archive_folder_url", "manifest_url", "manifest_sha256"]},
    "provenance": {"type": "object", "required": ["source_url", "collected_at", "method_version"]},
    "access": {"type": "object", "required": ["catalog_path", "manifest_url", "raw_data_policy"]},
    "limitations": {"type": "array", "minItems": 1}
  }
}
